stage,ConditionName,Value,Description,qOrigin
0,interact,NPC_villagechief,Speak to the Village Chief.,NPC_guardcaptain
1,rating,70,Achieve a rating of 70 or higher.,NPC_villagechief
2,capture,BOSS_skullknight,Capture the Skull Knight.,NPC_villagechief
3,interact,NPC_villagechief,Speak to the Village Chief.,NONE
4,interact,NPC_fakevial,Acquire a Blood Vial.,NPC_villagechief
5,interact,NPC_villagechief,Speak to the Village Chief.,NONE
6,interact,NPC_guardcaptain,Report to the Guard Captain.,NPC_villagechief
7,interact,NPC_fakedoor,Return to the Cursed Woods.,NPC_guardcaptain
